XX	You know , Larry , I have never , ever acquitted a client based on reasonable doubt . If you start talking to juries about reasonable doubt , what they say is , here 's the jury . Let me be the juror a minute . You know , Spence is out there talking about reasonable doubt . That 's just a cute lawyer trick . It really means that he 's guilty but he has n't proven him guilty enough . The prosecution has n't done its job quite well enough . But they know and we know and the defense knows and the defendant knows , everybody knows and we know that he 's guilty . So this reasonable doubt is just lawyer talk , and let 's get down to the nubbins here and get this case decided in accordance with justice . That 's what jurors do . Now , that being the case , I have the responsibility , contrary to the law , contrary to the business of presumption of innocence , I have the duty to prove my client innocent . And if I do n't carry that burden , my client is going to be convicted . I never heard it put that way . Do you agree , Mark ? There really is no presumption of innocence . There is no presumption of innocence . If you get somebody to be honest with you , when they see you next to your client on that side of the counsel table , virtually everyone will tell you , if they 're honest , you know , where there 's smoke there 's fire . If this guy did n't do it , why would he be here ? Or if he did n't do this , he did something else . So when you 're asking jurors , at least my experience , whether or not -- as you sit here , can you presume my client to be innocent and they say , oh , yes . And you say they just read off 15 charges in the indictment that charged him with all these heinous crimes . Do you have any reaction ? And the juror said , oh , no , I have no reaction at all . You know they 're lying through their teeth at you , and you have to understand that . I do n't know about Gerry , but I often prefer a juror that says , yes , when I looked at him , I figured there 's something here . Where there 's smoke there 's fire . At least then , I have somebody I can engage in an honest dialogue and they 're not lying through their teeth at you . Can I tell a story ? Yes , when we come back , we 'll tell the story . We 'll take a break . We 'll be right back . The book is " Beyond a Reasonable Doubt . " Do n't go away . Welcome back to this Super Bowl eve edition of "LARRY KING LIVE . " We 're discussing the book " Beyond a Reasonable Doubt . " I wrote the introduction . Owen LaFave has as wonderful book out , " Gorgeous Disaster , " the tragic story of Debra LaFave . All right , Gerry , what 's the story ? OK . I 'm defending a sheriff of having killed his undercover agent , shot him between his eyes in the back seat of the sheriff 's car . It 's been publicized all over . It 's been on "60 Minutes " and all the rest and everybody says this sheriff ought to be hung for killing his undercover agent . So I go to the jury and I begin to do just what Mark Geragos says . You 've read all this . Do you think he 's guilty ? Oh , no . Well , do you think he 's guilty ? Well , some of them say , well , yes . A few of them said yes . Some more of them said yes . Then a bunch of them said yes . Then there were three or four that said no .
XX	So the ads I saw -- and maybe this goes into that 50 percent -- I saw an editorial that said the reason why there` s so much slapstick this year is because America is just so tired of the war . This is our violence coming out . I saw that , too . I must really -- I must really not be that smart , because I never put together " The Three Stooges " quality with , you know , the malaise about the Iraqi war . You know , it` s not that , Dave . It` s that we do n` t have a life . It` s not that we`re -- we`re just not looking to make an issue out of absolutely nothing . I think that` s what it is . I`ll be honest . Sometimes articles like that do make me question my intelligence . I think is it me ? Is it me ? And here` s what I always come up with . Wow , it just is me . I guess I` m smarter than everybody else . Dave , thanks a lot . All right , buddy . Back with " The Real Story " in just a second . All right . Welcome to " The Real Story . " This is where we try to cut through the media spin and figure out why a story is actually important to you . Yesterday , most of us were watching the Super Bowl , but the hottest action was n` t on the field in Miami . The real story is that I`ve been telling you right here since last summer the Islamic extremist holy war is heating up , and the temperature is as hot as something that has not been seen since biblical times . From the shores of the Persian Gulf to those of England` s Thames to our own Lake Michigan , violence is escalating and putting us on the brink of World War III . Now , if for some reason you`re still in denial , I beg that you listen to this . What used to be a theory is quickly becoming a terrifying and irrefutable fact ! Iran` s president , Ahmadinejad , has just I guess gotten bored with yesterday` s big game so he planned his own Super Sunday . Next Sunday , February 11th , he` s going to reveal some of Iran` s giant achievement in science , including a cure for AIDS . Really ? Supposed to be herbal , they say . Something tells me it` s probably going to look a lot like a machete . And news also going to be announced of their nuclear progress . The real story is Iran is getting dangerously close to achieving nuclear capability . Too close for some of their neighbors , like Israel . Reports surfaced yesterday that Iran` s leading nuclear scientist has died under "mysterious circumstances . " U.S. intelligence sources reportedly cite very strong intelligence that he was assassinated by the Mossad , the Israeli security agency . Israel denies any involvement in this , but I`ve got to ask the question : Why would anyone in this country say that out loud , even if we had the proof ? If Iran should get a nuke , whether they buy one from the Soviets or make one of their own , Israel knows that their target number one , and we`re not far behind . I could n` t blame them if they did take aggressive steps to ensure their own safety . You know , by taking out Iran` s leading nutty professor , I` m OK with that . I just wish we have the same kind of commitment here in this country .
XX	That brings us to the subject of our poll tonight : should vaccinations against the STD Human Papilloma Virus be mandated for sixth-grade girls across the country in your opinion ? Yes or no , please cast your vote at loudobbs.com . We 'll have the results for you here later in the broadcast . Time now take a look at some of your thoughts . Bonny in Illinois said : " I read with disgust the president 's comments regarding CEO compensation . He said that it should be tied to the value provided to shareholders . Does n't this mean more of the same , companies so concerned about the shareholders that U.S. workers are forgotten ? " And Barbara in Ohio : " Bush lives in an upside-down world . Sending Border Patrol Agents to jail , presidential pardons for drug dealers , billions for Iraq , tax breaks for the rich , cut benefits and services for the poor and aged , with reductions in Medicare and Medicaid . Upside-down " And Delores in Texas : " We knew this would happen -- Ignacio Ramos , former Border Patrol agent , was recognized and beaten by other inmates on Saturday . What a travesty of justice for this man . " Send us your thoughts to loudobbs.com . More of your thoughts coming up here later in the broadcast . Each of your whose e-mail is read here receives a copy of my book , " War on the Middle Class " . Up next here , new legislation on Capitol Hill aimed at protecting America 's struggling middle class . We 'll have that story , tell you all about it . And arctic temperatures from the northern plains to New England have taken a deadly toll . We 'll have the very latest and the weather forecast for the nation upcoming . Stay with us . A love triangle has an elite NASA astronaut facing attempted murder charges tonight . The astronaut took off on a wild 900-mile dash across the country to confront the woman she thought was her rival in that triangle . The astronaut , Lisa Nowak , is free tonight on $ 25,000 bail facing charges of attempted murder . And now Kyung Lah with a report for us from Orlando , Florida -- Kyung . Well , Lou , bond was posted just a short time ago , about an hour ago . And that 's when Lisa Nowak , a NASA astronaut , did least jail here . Let 's give you a look at her as she is departing the jail . She was surrounded . She was the center of this throng of cameras and reporters . Her head was covered and then she slipped into a car and left . This was after her second hearing of the day , when she was charged with attempted first-degree murder . For the second mine a day , NASA astronaut Lisa Nowak faced charges , this one far more serious . Murder was the plan . And it just was not able to be carried out . In the charging affidavit , Orlando police say Nowak was carrying a black duffel bag . They say she approached an apparent romantic rival , Colleen Shipman , in a parking lot at Orlando Airport . Authorities say the bag contained a steel mallet , a Buck knife with a four inch blade and a bb gun that resembled a 9 millimeter . Nowak 's attorney told the court the physical evidence does not mean Nowak had intent to kill .
XX	That 's a really sad story . Let 's turn now and talk a little bit about business news . Miller wants beer drinkers to chill out . Twenty-five minutes past the hour . That means Stephanie Elam is " Minding Your Business . " Hey , Stephanie . Good morning . Hi , Soledad . That 's exactly it . Miller Brewing is now going to start selling cerveza , as it turns out . What 's going on here , next month they 're going to start selling -- or actually , I should say testing a beer that 's flavored with lime and salt in a few parts of the country . Specifically targeting Latino areas . And it 's calling it a modern American take on a Mexican classic . It 's a low-calorie beer called Miller Chill . And it 's modeled after a popular style of Mexican beer called Chelada . Now , it 's going to compete against other light beers , and it will be tested in Florida , Texas , Arizona , New Mexico , and in San Diego as well . They 're hoping to expand nationwide eventually . Now , moving on from there to a story about $ 6 million , it 's about poker , actually . It 's a dispute that has finally been settled and it has to do with this man named Jamie Gold , who won $ 12 million after winning the World Series of Poker main event last summer . He was then sued by Bruce Crispin Leyser , who is a television producer , actually , who claimed that Gold had promised him half of the money if he won . Now , Gold probably did not think he was actually going to win . The odds were totally against him . He 's not a pro when it comes to poker . And on top of it , 8,700 people were enrolled in this event overall . But now Gold has said that he has paid up . We do n't know , however , if he paid the exact full $ 6 million , but apparently both sides are happy about how things turned out . So I guess even if you do n't think you 're going to win , keep your mouth shut so you can keep your money . That 's the takeaway from that . There are so many instances where that takeaway is relevant . And it has -- I mean , I think a Chicago Bears player just went through that , too . So you 've got to be careful about what you say if you do n't mean it . You know ? Because you think you 're not going to win . Yes . The next thing you know , someone is suing you and you 're getting calls from lawyers . And they 'll call . They 'll remember . Yes , they will . That 's why they 're lawyers . All right . Stephanie Elam for us this morning . Thanks , Stephanie . ELA Sure . A look at the top stories of the morning are coming up next , including a developing story out of Iraq . Another U.S. helicopter has been shot down -- is down . Was it shot down , is the question now . We 're going to bring you the very latest on that story . And after his stunning fall from grace and three intense weeks of rehab , we 'll tell you what Pastor Ted Haggard now says is his next move . He 's got a completely heterosexual life , we 're told .
XX	Coming up on AMERICAN MORNING , it is Fashion Week in New York City . And our own fashionista , Alina Cho , is live in the middle of it all . She could n't be happier . Look at that smile . It 's her favorite assignment every year . Hello , Alina . Hi there , Miles . Behind the scenes , though , the real big story is business . Big business . I 'll have much more on this live from the tents when AMERICAN MORNING continues . Welcome back to the most news in the morning . Green is the new black , they say . At least during Fashion Week in New York City . Green , as in money . Fashion Week makes more than $ 200 million for New York City . Alina Cho goes behind the seams for us this morning . She 's at the tents at Bryant Park in New York . Hey . Good morning . Hey . Good morning , Soledad . First and foremost , Fashion Week is all about fashion . But , as you mentioned , it is also a huge moneymaker for the city of New York . It 's why major corporations come here . They road-test their products . And it 's also made the careers of more than a few famous designers . It 's a spectacle and some might say superficial , but Fashion Week is big business . It 's made Gilles Mendel 's career . I think I 'm , like , the best example , where , you know , my dream came true , and really a large part of my success is thanks to the shows . CH Before he started showing in the tents two years ago , Mendel was known as a furrier . He wanted the public to see he could make more than just coats . Very nice . So he crafted a collection for the runway . Each show costs him $ 400,000 -- and that 's twice a year . What he gets back is priceless . All the press all over the world take all those pictures and print them in every magazine , on the Internet , all over the world . Those pictures sell clothes . In two years , Mendel 's business has multiplied from $ 5 million a year to $ 30 million a year . It 's not just designers . Mercedes-Benz spends millions to be Fashion Week 's title sponsor . There are many others , including MAC Cosmetics , which supplies makeup and services to most of the shows . Why do they get involved ? In a word , branding . From runway to real ( ph ) way . I mean , really what you see is inspiration , looking forward to trends in the future , yet the reality of it is you 're seeing makeup created right now . In some ways , it 's an easy sell . One hundred thousand people come to the tents during Fashion Week , and the fashion crowd is a captive audience . They stay in good hotels . Fine restaurants . They go to the best restaurants . They check out every new restaurant . They go shopping . They know how to spend money . They like to spend money . Fashion Week generates an estimated $ 235 million for New York City over just eight days . Good for the economy , good for business , and very good for Gilles Mendel . The runway show has really transformed completely my company . And I really give thanks to those runway shows . You know , really living a dream .
XX	That 's the journalist in you . I always wanted to ad a ly every time I heard that to , differently . Yes , I know . Good morning , Soledad and Miles . And this is a story that we have been covering for two days now . And it just is not ending . First of all we have Apple , Steve Jobs , coming up and saying the music industry needs to get rid of their anti-piracy software . And then after that , the music industry said , hey , no , you need to loosen up your software . And now EMI , which is the record label behind ColdPlay , as well as the Rolling Stones , are saying , we 're looking at actually talking to online retailers and selling our entire digital music catalog to them . This is according to " The Wall Street Journal . " Let 's see how this plays out . But if that did happen , anyone who has an MP3 player would be able to play their music . Let 's move on and take a look at the view from Vista . Microsoft 's new operating system has been doing really well for PC sales . It turns out that PC sales rose 67 percent in U.S. retail stores in the first week on the market . Leading the charge was Hewlett-Packard . They saw their share of those sales up about 50 percent . Actually a little bit more than that . And so they did lead the industry with that . The last time a Windows operating system came out , it was XP in 2001 . Vista delayed twice . So people have been waiting around to upgrade to this one . Let 's move on and take a look that the markets yesterday . The Dow , a little bit on the down side , off about 29 points yesterday , down to 12,638. And that was hurt by indications of weaknesses in the housing market , despite some strong retail sales numbers , as well as earnings results . The Nasdaq was also off less than two points though at 2,488 . So we 'll have to see if we can end the week here on a positive note and see what happens today . Thank you , Stephanie . We 'll be watching it , no matter what happens . No matter . All right , Stephanie , thanks . Top stories of the morning are up next , including a startling new report on autism . We 'll tell you how common the disorder really is . Plus , we 're going to talk to the last reporter to interview Anna Nicole Smith , " Entertainment Tonight 's " Mark Steines . Did he see any signs of trouble ? You 're watching AMERICAN MORNING. The most news in the morning right here . The child who 's now been left behind . An autopsy today on Anna Nicole Smith and a new fight for the custody of her 5- month-old daughter . Extreme weather . Seven feet of snow on the ground in parts of the Northeast . More on the way . Sounding a new alarm on autism . The devastating condition is more common in children than was first thought . The new numbers straight ahead on this AMERICAN MORNING. Welcome back , everybody , Friday , February 9th . I 'm Soledad O'Brien .
XX	And so -- but what it did produce was this headline the next day in every paper that said , Senate Republicans block the debate . And I think that is instructive , because it does tell Americans that Congress , as an institution , as much as people thought the Democrats are taking over , this is a new direction , Congress as an institution is just not equipped to deal with issues like this . All right . Well , this is one story that 's not going away . And as you say , Katty Kay , it is driven by the still strong passions about this war and how we got into it . Katty Kay , Matthew Felling , Karen Tumulty , thanks very much for joining us . Up next , FOX vows to take on CNBC for business supremacy . And later , from Sunday morning talk show host , to star witness , Tim Russert on the hot seat at the Scooter Libby trial . Also , the mayor of San Francisco having an affair with an aide , heading into rehab . Why Arianna Huffington does n't think that 's much of a story . Time now for the latest from the news business in our " Media Minute . " Jeff Zucker has been ticketed for big things at NBC ever since he became executive producer of the " Today " show at the age of 26 . This week , the network announced , to no one 's great surprise , that Zucker will succeed Robert Wright as head of NBC Universal Television , making him the first person from the news division to ascend to the top job . We got a lot of e-mail this week saying we 've been too hard on CNBC 's Maria Bartiromo in that flap about whether she had gotten too cozy with an executive with Citigroup . But Rupert Murdoch says the network 's problem is that it 's too antagonistic toward business , too quick to leap on every scandal . Murdoch confirmed that he will enter the arena by launching a FOX business network by the end of the year . We wanted to be a little bit more business friendly , I think , than CNBC has been . There 's just an atmosphere to it that 's a little bit negative , I think . Fair and balanced coverage of the corporate world ? Well , never underestimate Murdoch . Ahead in the second half of RELIABLE SOURCES , NBC 's Tim Russert was the one getting grilled this week in the Scooter Libby trial . Plus , free speech philandering and flying . John Edwards ' inflammatory bloggers , Gavin Newsom 's San Francisco sex scandal , and Nancy Pelosi 's costly plane are all fodder for our blogging guests , Glenn Reynolds and Arianna Huffington . All that after a check of the hour 's top stories from the CNN Center in Atlanta . Welcome back . Tim Russert took the witness stand in the Scooter Libby perjury trial this week , and Libby 's lawyer suggested that he might have it in for the former Dick Cheney aide , playing a clip from " Imus in the Morning " shortly before the indictment was announced . TIM RUSSERT , HOST , " MEET THE PRESS" : It was like Christmas Eve here last night . You know , Santa Claus is coming tomorrow . Surprises -- what 's going to be under the tree ?
XX	Anna Nicole Smith . Why was n't she ... Well ... ... she was living with the baby . I think she went to Florida to look at a yacht for a short period of time . Well , here 's -- here 's -- here 's the question , though ... ... she died . ... though , Lisa . Why are so many men coming forward to claim paternity ? Are they just trying to wear this as a badge of honor ? No. Or are they after the money ? They think this is a $ 400 million baby . Yes . This is ... ... because she was entitled ... This is -- this is a financial ... ... to this huge judgment at one point . It was reversed to zero , then went up to $ 80 million , reversed to zero again . She won in the Supreme Court . Mm-hmm . So , she gets to keep fighting . And even if... That 's why . ... all the money ultimate goes to Dannielynn , the little baby , someone will have to be appointed a guardian for her ... Yes . ... who will have control of that money for years , and will be presumably paid some fee for being a guardian . So , even -- so , just being named the guardian and the -- you know , and the father would be the best candidate for -- for guardian -- you know , that 's a huge -- that 's a huge amount of money . Yes , they 're not just signing up for diaper duty . Well ... BLOO I think there 's a pot of gold ... Well , we do n't know , at this point , who the guardian is going to be , but , apparently , we have an idea of who the executor of the estate is going to be . And that 's Howard K. Stern . He said , in terms of his relationship with Anna Nicole Smith -- quote -- " I work for Anna exclusively , and I have for quite some time . I 'm proud of that fact . " Yes . A lawyer with one client who has an extreme conflict of interest in this case . Who he is sleeping with , yes . ... who was sleeping with her , who is also the executor of her will ? Yes , shameful behavior . Does that strike you as being a little odd ? Shameful , unethical in every state . And I wonder if someone is going to bring an action to say , he should n't be executor of her will . He had a conflict of interest in doing that . Who has standing to bring that lawsuit ? Well ... That 's the problem . You know , maybe the father of the baby , in the name of the baby . I mean , there 's so much litigation that 's ... ... she 's done before . Because the baby is the heir , correct ? The baby is clearly her legal heir . Well -- I mean , well , we do n't -- I mean , we assume it is , if that is what is in the will . I mean , if there 's a will , the will will say who is the heir . The will -- the will says Daniel . ROBERT Although , apparently , what was in the will was that the money went to Daniel , right , the son . Right .
