XX	When USC coach Pete Carroll agreed to a five-year contract extension last week , he said , " I want to see how far we can take this . " Some might argue he found out before serving a day of his new agreement , when USC lost to Texas in the Rose Bowl and fell short in its historic chance for a third straight national title . Without quarterback Matt Leinart , tailback Reggie Bush , offensive tackle Winston Justice and possibly tailback LenDale White , the Trojans suddenly look a lot more normal next season . " Now the question is can you be dominant three out of four years ? " Carroll said , wondering if the Trojans can win a national championship next season . " We 've done this before . I ai n't worried about it . " Maybe not , but right now it 's hard to say who could replace Leinart and Bush , or if it 's even possible . If you listen to the hype , the Trojans lost two of the greatest quarterbacks and tailbacks in college history . As impressive as USC recruits these days , it 's hard to imagine another Bush turning up , and even Bush required time to develop as a freshman , which means next year the Trojans might not be able to just win on sheer athletic ability . Who is going to break off 36- and 45-yard touchdown runs against Notre Dame , like Bush did against the Irish this season ? Those plays did n't get the attention of Leinart 's fourth-and-9 pass to wide receiver Dwayne Jarrett , but they were just as important and prevented the Irish from building momentum . No one on the current roster is even close to Bush 's explosiveness and if White goes pro , tailback becomes a huge question mark . The Trojans go into next year with a committee of Hershel Dennis , Desmond Reed , Chauncey Washington and Michael Coleman at tailback . Additionally , USC will bring in at least three recruits at tailback . Emmanuel Moody ( Coppell , Texas ) committed Saturday , while Stafon Johnson ( Dorsey High of Los Angeles ) and Michael Goodson ( Houston ) are also expected to select USC. The quarterback situation is less muddled but still a question mark . Sophomore John David Booty played in seven games this season , which is far more experience than Leinart got before he started . But will Booty beat out highly regarded freshman Mark Sanchez ? Between the two , Sanchez owns the stronger arm , but Booty 's been in the program three years . Carroll wants to choose a starter in spring practice , like he did with Leinart in 2003 , so everyone knows who the No. 1 quarterback is before training camp . That presents a dilemma : Booty would be a safe choice , but Sanchez possesses more potential . There wo n't be any problems finding someone to throw to , because USC returns starting wide receivers Jarrett and Steve Smith , along with freshman Patrick Turner . The offensive line returns three starters ( Ryan Kalil , Fred Matua , Sam Baker ) although offensive tackle Winston Justice is expected to turn pro . It 's still a pretty good offense , but not the greatest in history , like the 2005 version made a claim for . And it will require a punter . But who ? Tom Malone graduated , and USC only has walk-on Taylor Odegard . No recruits impressed the coaches in the summer , and USC might sign a junior-college punter as a stop-gap measure . The role of freshman kicker Troy Van Blarcom also figures to increase . Carroll said Van Blarcom would have kicked a game-tying field goal against Texas in the closing seconds , even though the freshman did not attempt a field goal all season . But next year , the Trojans are going to need a long-range kicker . Going for it on fourth down inside the 30-yard line wo n't be as easy without Leinart and Bush . The lack of experience at tailback and quarterback puts the burden back on the defense , which will be considerably stronger next season . Linebacker will be the Trojans ' top position , especially at the middle ( Oscar Lua , Rey Maualuga ) and strong side ( Dallas Sartz , Thomas Williams , Brian Cushing ) spots , where five starters return for two positions . It wo n't surprise anyone if Carroll finds a way to get as many of those players on the field as possible . Sartz could play safety , especially if junior Darnell Bing goes pro . That would enable Josh Pinkard to remain at cornerback , although he 's expected to return to his natural safety spot . Terrell Thomas , Kevin Thomas and Cary Harris will be the top candidates at cornerback . The defensive line remains solid , losing only senior Frostee Rucker . Defensive ends Jeff Schweiger and Kyle Moore assume far bigger roles at defensive end and make the Trojans bigger and more athletic . Defensive end Lawrence Jackson , despite being nearly invisible against Texas , will be projected as an All-American candidate next season . But more than names and faces , next year 's USC team also battles expectations . A 37-2 record the past three seasons means no one on the current roster knows what it means to lose three games in a single season . USC opens at Arkansas ( where Coach Houston Nutt no doubt remembers the Trojans throwing play-action touchdown passes with a 63-17 lead ) and the second game is against Alamo Bowl-winner Nebraska . Even Carroll acknowledged it 's tougher to get back to the top than staying there . " I like the burden , I have n't had a problem with the burden , " Carroll said . " Is it harder to stay there or get there ? We 'll find out now , but we did n't have a problem staying there . "
XX	President Bush snubs the rest of the world so completely with his standoffish foreign policy that the international credibility of the United States has been eroded -- for no good reason -- U.S. Rep. Adam Smith , D-Tacoma , charged Saturday . From the time of George Washington , America set itself apart from other countries by treating war prisoners fairly and by urging human and civil rights , Smith said . But those days have disappeared under the Bush administration , he told a crowd of about 300 people gathered for a town hall meeting in Tacoma . " The message is sent to the rest of the world we 're not that shining city on a hill any longer , " he said . " We 're just a bunch of thugs trying to get our own individual advantage . " In a wide-ranging 90-minute session , during which he answered questions from the friendly , predominantly anti-Bush , anti-war audience , Smith also said : -- He originally backed the U.S. invasion of Iraq , but he now believes " the president has shown he 's not worthy " of the faith and trust Congress and the American people put in him . -- He favors a gradual , rather than abrupt , withdrawal from Iraq . " We need to be very respectful for what our troops are doing , regardless of what we think about the war , " he said . -- He believes the " White House attitude and approach toward civil liberties , " as evidenced by recent stories of monitoring the telephone calls of some U.S. citizens without warrants , "is deeply concerning . " Smith , a member of the House Armed Services and International Relations committees , recently returned from his second trip to Iraq . When he was there in 2004 , it was clear to troops on the ground that the administration had a plan for knocking out the regime but no blueprint for was to happen next , Smith said . During a trip at the end of 2005 , he learned that U.S. troops remain committed to their jobs , but they 're tired and want to come home , he added . " It should be the stated policy of the United States that we will have no permanent bases in Iraq , " he said . It 's time to turn the country over to its own people , Smith added . But a complete withdrawal now would be a mistake , he said , because the country needs more stability . " The only real measure of progress over there is when we start getting out , " he said . The five-term congressman wants Congress to investigate what he believes is the administration 's lack of regard for truth about prewar intelligence and support for "unauthorized wiretapping . "
XX	or canceled flights for passengers and significant cost savings for airlines . At Reagan National Airport , the RNP procedure has already proved itself . Since the system 's quiet approval in September , Alaska Airlines -- the only airline certified to use the procedure there -- has used it 10 times to land at the airport on the west bank of the Potomac River , said airline spokeswoman Amanda Tobin . Three of those times , Alaska was able to land successfully when other airlines ' planes were forced to divert to other airports . At Juneau , where the system has been in use the longest , RNP has saved hundreds of flights from diversion , the company said . Throughout Alaska 's system , the airline flies about 6,000 RNP approaches a year , said Kevin Finan , the airline 's vice president of flight operations . That navigation system typically saves the airline about 800 diversions or cancellations a year . In addition , RNP has helped bring customers to their destinations when less-sophisticated instrument landing systems would have been inadequate . For isolated Alaska communities , the RNP system has made connections more reliable even in the inhospitable weather that plagues the 49th state . No straight lines needed With the FAA , the SeaTac-based carrier has developed RNP navigation programs for several other difficult airports , including Palm Springs , Calif. , Sun Valley , Idaho , San Francisco and several smaller Alaska cities . The advantage of the RNP system compared with a conventional Instrument Landing System is that the plane 's path toward the airport does n't have to follow a straight line , said Sarah Dalton , Alaska 's director of airspace and technology . Instead , the RNP path can follow a curving path with irregular altitude changes that are required in some particularly hemmed-in airfields . The RNP approach to Reagan from the north , for instance , follows the meanders of the Potomac River past some of the most recognizable landmarks of the nation 's capital : the Watergate apartments , the Kennedy Center , and the Lincoln Memorial . That path down the river was picked to minimize the noise impacts on such upscale residential areas as Georgetown and Foggy Bottom while keeping the plane clear of security-sensitive offices and landmarks . The RNP system is so precise that the FAA allows planes to land in much worse weather than they would in a conventional instrument landing approach , Finan said . At Reagan , for instance , aircraft using RNP can land when visibility is 1.25 miles and with a ceiling of just under 500 feet . With a conventional approach , the limits would be 2.25 miles visibility and a 750-foot ceiling . FOLLOW THE LEADER Other airlines are following Alaska 's lead . Both JetBlue Airways and American Airlines have applied to use the RNP approach to Reagan . Continental Airlines uses RNP at several airports , including Tel Aviv in Israel . Alaska and the FAA now are developing RNP approaches to more airports that frequently experience weather delays . In this state , Wenatchee is in line for such an approach . Nationwide , the FAA plans to create RNP approaches this year to 25 additional airports , including JFK in New York , Chicago 's boxed-in Midway Airport
XX	FOR MONDAY AMs The following stories are on the front page of the Business Section of the New York Times for Monday , Jan . 9 . They are scheduled to move by 7 p.m. unless otherwise noted . For information on stories or for reruns , please call : 888-346-9867 or 212-556-1927 . For information on NYT photos and graphics , call 888-603-1036 or 212-556-4204 . ( Lede story ) ORCHARD-ONLINE-MUSIC ( Undated ) -- A company called The Orchard is making a big bet -- that the economics of online music distribution will make it viable to buy up music from across the world , even if they sell only a handful of copies of each track . By Robert Levine . ( Top left ) CARR-COLUMN ( Undated ) -- Some powerful women this week hit the glass ceiling and some fell through the glass trapdoor . By David Carr . ABC-NEWS ( Undated ) -- Jon Banner , the executive producer of ABC 's " World News Tonight , " faces the challenge of reviewing the evening news cast for a new audience . By Jacques Steinberg . ( Bottom display ) WALMART-ASSESS ( Undated ) -- Why the defense of a Walmart executive indicted for embezzlement -- he used the money for an anti-union project -- worked in the media but not in court . By Michael Barbaro . ( Editors : Budgets and advisories are internal documents not for publication or redistribution outside of client news organizations . Unauthorized use of budgets and advisories constitutes a violation of our contract terms . All clients receive all budgets , but only full-service clients receive all stories . Please check your level of service to determine which stories you will receive . )
XX	BUCKHANNON , W.Va . - They laid the earthly remains of Jesse Jones to rest Sunday in a polished wooden box beneath the rocky soil of Appalachia . " Jesse was and is a coal-mining man , " said the Rev. Donald Butcher . " Jesse 's grandpa on his daddy 's side died in a mine explosion . Coal mining runs deep in the blood of many of our families . " Then , as the preacher comforted Jesse 's widowed mother , Lulu Belle Jones , somebody turned on a CD of Vince Gill singing . " Go rest high on that mountain . Son , your work on Earth is done , " the haunting , disembodied voice rang out . " Go to heaven a-shouting love for the Father and the Son . " There was n't a dry eye in the crowded chapel of the Tomblyn-Whitescarver Funeral Home , located about 10 miles from the Sago coal mine where Jones and 11 of his co-workers perished last week . In several grieving mountain towns , funerals for six dead miners were held Sunday . In addition to Jones , they were Jackie Weaver , Martin Toler Jr. , David Lewis , Alva Bennett and Jerry Groves . Services for the others were scheduled for Monday and Tuesday . " God has 12 new angels , " said the sign at the Go-Mart in Buckhannon . At the entrance to the Sago mine itself , the Associated Press reported that 12 big , black bows were tied to a fence . In nearby Philippi , Weaver , 52 , was buried on a snowy hillside beside the grave of his son , Jackie Jr. , who died in 1982 at the age of 11 in a moped accident . Among the items in the elder Weaver 's casket were a camouflage hunting cap , a homemade " Happy Birthday Daddy " card made of yellow construction paper , and a child 's drawings of a father in a miner 's hard hat . Weaver , who spent 26 years working in the mines , always wrote " Jesus saves " in the coal dust of the cart that took him and other miners into the dark shaft , his cousin , Scotty Felton , told the AP. In the casket of Jesse Jones , 44 , were pictures of his daughters , Sarah and Katelyn , and an embroidered pillow reading " Daddy 's Girl . " Butcher spoke movingly of the hard times that folks in these parts have endured for generations . " My family were coal miners , " he recalled . " When my grandpa was 26 or 27 , he was setting a charge in a coal mine and the explosion blinded him . He never set eyes on me , and he walked with a cane for the rest of his life . " But the preacher said he loved and missed his "paw-paw , " whose disability entitlement from the mining company came to $ 18 a month . " Coal miners are a different breed , " he said . Speaking of Jones , he said , " Here 's a young man , just 44 years old , who spent 21 years , nearly half his life , in a coal mine . God gives us people who are heroes and we do n't even realize it . " Jones was a loving son , father and brother , the preacher said . He liked "hunting , fishing , pitching horseshoes and digging ramps . " Folks do n't appreciate what miners contribute to the country , the preacher said , adding , " America is great because of men like Jesse Jones . " A few "amens " rumbled through the assembly . Butcher read the lyrics from a song titled " A Coal-Mining Man . " " Daylight or dark , rain or shine , " they went . " It do n't matter much , down in the mine . " Meanwhile , doctors treating Randal McCloy Jr. , the only survivor of the ordeal in the mine after an explosion a week ago , hoped to ease his medically induced coma on Sunday , allowing physicians to perform a neurological exam , the AP reported . " It has been very difficult to allow him to awaken , although that is our hope today , " said Dr. Larry Roberts , the head of McCloy 's treatment team at West Virginia University 's Ruby Memorial Hospital . Doctors placed McCloy , 26 , in a coma to give his brain time to heal . McCloy 's wife , Anna , spoke briefly with reporters , asking that Sunday 's attention should focus on those whose lives were to be remembered . " We are thinking of them today and throughout this difficult time , and we ask you to please keep all the families in your thoughts and prayers , " she said . This report contains material from the Associated Press . Bob Dart 's e-mail address is bobdartcoxnews.com
XX	Video gaming is not the only technology incorporated into the Urge . In addition to the Xbox 360 , there is an iPod docking station and a cell phone that doubles as a " smart key " to start the engine . In at least one respect , the Urge might be the perfect car : it burns no gasoline while parked for game playing ; it generates no emissions ; it lines up in no traffic jams . It can virtually roll through the streets of Las Vegas or spin around the Nuerburgring . Its version of Gotham Racing can even run uptown on the parts of Broadway that are one-way heading downtown , a special thrill for Manhattan drivers . With a wireless connection , in theory , two Urges could be parked side-by-side for competition like the old racing games at the arcade in Atlantic City . Thanks to the Internet , the same thing could be done even if the Urges were half a world apart . The game encourages stylish driving . Good driving through the curves earns the driver style points , called Kudos , that can be redeemed for a better vehicle . According to the Microsoft programmers , power sliding , pulling off a 360-degree spin , getting air time , drafting and getting up on two wheels " will earn gamers Kudos points for their style and skill . " Too bad the real automotive world does n't work this way . Each car in the game is made up of 80,000 polygons and takes eight days of programming by its creators , who are holed up in the London studio of Bizarre Creations . Real-world details include gauges that move and realistic bug-smash streaks on the windshield . Oddly , the Urge itself is not among the cars you can drive on the screen . That will probably be remedied soon . Project Gotham players and programmers regularly produce new cars that can be downloaded . The Urge 's notion of car-as-video game is not unprecedented . A similar concept , the Scion Speedster -- a red Scion xA show car built by 5 Axis Productions in Huntington Beach , Calif . -- was displayed at the Specialty Equipment Market Association trade show in Las Vegas last fall . The Speedster also has an open panel in the doors -- and two Xboxes running the Forza racing game onboard . The two cars simply evolved at the same time , Cupit said . He prefers his version of the idea . " We tried to take seriously designing the door glass to protect the occupants from wind and rain , and also vehicle ingress-egress , " he said . " Our door moves up and down to ease entry into the car , for example . " " We often visit tuner and customizing shows to see what young people are thinking about , " Cupit said . " The Urge helps reinvent the sports car for the next generation of young people . " Observing young people at auto shows , it is impossible not to note that they pay more attention to how their cars look and sound than how fast they go . The investment tends to go into electronics and colorful bolt-on parts , rather than into making the engine run faster and more furious .
XX	After poring over Guidant 's confidential financial records for more than a month , Boston Scientific said Sunday that it would make a formal , binding bid worth $ 25 billion in cash and stock for the company . The offer is expected to set off a takeover battle between Boston Scientific and Johnson &amp; Johnson , which had already agreed to buy Guidant for $ 21.4 billion . Johnson &amp; Johnson lowered its earlier $ 25.4 billion offer because it said a raft of safety problems had diminished Guidant 's value . The board of Guidant , the nation 's second-largest maker of implantable defibrillators and pacemakers after Medtronic , is expected to meet early this week to evaluate the proposal . If Guidant 's board deems Boston Scientific 's bid to be superior , Johnson &amp; Johnson will have five days to respond with a new , higher offer . Investors and analysts have been waiting anxiously to see if Boston Scientific would be comfortable enough to continue to pursue its bid after reviewing Guidant 's internal financial and safety records , especially after it was disclosed last month that the Food and Drug Administration had new reports about patient deaths associated with short circuits in Guidant 's heart devices . In an interview Sunday , James R. Tobin , Boston Scientific 's chief executive , said he was satisfied with what he saw at Guidant . " We did very thorough due diligence , " Tobin said . " We put a full-court press on this thing . The Guidant folks were very open to us . Clearly they have some short-term challenges . We 're realistic about what we 're dealing with here . " Tobin added that beyond studying Guidant 's own records , Boston Scientific also talked to doctors and others involved in health care to gauge the vitality of the business . " There are clearly trust issues that have developed , " Tobin said . " On the other hand , Guidant 's technology is acknowledged to be right up there . And we think there 's an opportunity to regain that trust . " As part of Boston Scientific 's formal offer , the company said that it had reached an agreement to sell two Guidant units , its vascular intervention and endovascular businesses , to Abbott Laboratories for $ 3.8 billion to satisfy regulators if it reaches a merger agreement with Guidant . Boston Scientific also said that its offer -- $ 36 a share in cash and the equivalent of $ 36 a share in stock -- would include what is known in the business as a collar , to protect investors should Boston Scientific shares fall and to protect Boston Scientific from paying too much if its own shares jump . Under the terms of its offer , Boston Scientific said that if the average closing price of its stock in a 20-day period before the Guidant board 's approval of the deal is less than $ 23.62 , Guidant shareholders will receive 1.5241 Boston Scientific shares for each share of Guidant stock . If the average price is greater than $ 28.86 , Guidant shareholders will receive 1.2474 Boston Scientific shares for each share of Guidant stock . Boston Scientific 's offer represents about a 12 percent premium over Johnson &amp; Johnson 's offer , based on the closing price of Johnson &amp; Johnson 's shares on Friday . Boston Scientific said it estimated that if a deal was consummated , the combined company would have $ 10 billion in sales in 2007 . It expects the combined company 's sales to grow at a double-digit rate , achieving $ 16 billion in 2011 . Boston Scientific 's side deal with Abbott is aimed at helping complete the deal quickly , but it also has big implications for Abbott and the industry . The side deal is likely to be criticized by Medtronic . The company had unsuccessfully opposed Johnson &amp; Johnson 's plans in its proposed merger with Guidant to license Abbott to use Guidant 's delivery gear for stents , which are used to open blocked blood vessels . Medtronic had argued that it was better positioned than Abbott to use the technology to provide added competition . Medtronic is likely to make similar arguments to regulators that Boston Scientific should be forced to give it access to Guidant 's technology . Abbott has been developing its own stent products . Last year , it became the second company after Guidant to gain regulatory clearance to market stents to prop open the carotid arteries , which are the main pathway for blood to the brain . But Abbott 's effort to compete in the multibillion-dollar market for drug-coated coronary stents has lagged far behind those of Johnson &amp; Johnson and Boston Scientific , the market leaders . The acquisition of Guidant 's vascular business would represent the company 's first major commitment to what had been a relatively cautious strategy of diversifying into device implants , which is dominated by companies like Medtronic , Johnson &amp; Johnson and Boston Scientific . Abbott acquired two startup vascular companies , Jomed and Integrated Vascular Systems , in 2003 .
