XX	When my old Sears vac died , I decided to try the Shop-Vac 610 - it looked strong and the stainless steel tank looked like it would last forever . One thing I neglected to check on was POWER . This machine is light duty , and I should have known the small hose size was indicative of its capability - it is not nearly as powerful as the old , noisy Sears unit . If anyone will make me an offer for this unit , I would like to upgrade to something that really performs like a shop vac should .
XX	These bags are the finast vacuum bags ever ....EVER ! So , if you need to vacuum fruitcake out of carpets , floors , or dog houses [where I stash mine ! ]....these bags are for you ! They truly offer superior sucking action [can I say that here ? ] . Seriously , I 've noticed that running my vacuum with these bags takes the cig-smoke out of the air ! Pretty impressive ! ! ! cheers ! SR...pro-reviewer
XX	I needed replacements for my air cleaner . No big deal , right ? Well it should n't have been , but wait till you check the prices for your Holmes air filter replacements . The operating expense of this unit for a year almost equals the initial amount paid for the whole unit . This complaint aside the two pack I got from Amazon is the best pricing I could find . My three star rating is more directed at the idea that Holmes has you over a barrel than the service I received from Amazon which I would have given a five star to .
XX	I 've had an older Jiffy Steamer for about 20 years , and it 's always worked like a champ . I 'm a professional photo stylist , so I use it a lot , and have taken it on many trips , so it 's been shipped just about everywhere . Finally decided to get a newer model , which is much lighter , thus less expensive to ship . I love it , works as great as the last one .
XX	Ive had this fridge for about 3 yrs now - i got this when i was 17 or 18 and it still works great and is worth the money . Its perfect for teenager or college students dorm . Ive had this in the bedroom since then and i have gotten compliments on it and how cool it was and its good to store some drinks and you can have a decent amount of food or other things in there but it is perfect size for the bedroom but inside it is small to medium storage capacity - but for its smallness it is very powerful and keeps drinks and other things ice cold and also comes with a little freezer compartment which is also very powerful- id say it can hold about a case of drinks or case and half and some room for food - its better for storing drinks . But overall good little fridge with lots of power and nice silver design .
XX	Earlier reviews complained about difficulty in finding a button for mulching . I guess they were right ; I could n't find one . The instructions just say the leaves will be mulched as they go through the impeller . After vacuuming a bunch of leaves and dumping them into a recycle bin , I could n't really see any evidence of mulching . The blower and vacuum work very well , however . Do n't make the mistake of trying to vacuum leaves from loose dirt ; you 'll suck up a lot of dirt . Blow the leaves into a pile and then vacuum them . Still , I like this tool . It 's much quieter and easier to use than my gas blower .
XX	I bought many of the OXO Good Grips kitchen gadgets for my wife to replace an assortment of older items that had just lost their looks , and so forth . This stainless slotted spoon as with all of the OXO Good Grips items we bought feels great in your hand , is well made and looks great . I would recommend the OXO Good Grips items to any of my family and friends , as a very nice home kitchen utensils set .
XX	For the reviewers that complained that they needed to go back to the vac to manually turn off the unit when using the "on-demand " feature , you need to return the unit to be repaired . My vac works perfectly when using the on demand feature . It has a delay of about 6 or 7 seconds before shutting off . This delay is a built in feature that allows the hose to clear itself before shutting down . I think most of the problems mentioned in the reviews have come from not reading the instructions ( I must admit , I 'm guilty of this myself from time to time ) . As far as clogging , all vacs with and 1 1/2 " hose will clog from wood chips . I invested in the larger hoses that amazon offers , and they fit perfectly into the vac intake . As far as the tool end connection to the hose , this is where good old yankee ingenuity will help . There are rubber fittings available that are " stepped " in size to accomadate different diameter connections , this item does n't work on all connections , but most . I did have to have the on-demand switch replaced after about 9 months of use ( reason for the 4 stars ) , but other than that this vac has performed extremely well . My main use of the vac is dust collection while being attached to my Bosch orbital sander . It picks up about 95 % of the dust , which is a huge improvement over using the attached cloth bags that come with some sanders . I have several of my shop power tools pre-fitted with vac hoses , and simply wheel the vac from tool to tool when needed . This vac is a great alternative to investing in a dust collection system , and all that goes with it , when you do n't have the room or the budget .
XX	I should qualify my 5 stars , because there 's not a juice extractor on this planet that is perfect -- they all have pros and cons . But the price , quality and convenience of this one makes it a winner . This juicer is similar to , and just as good as , the original Acme/Omega juicers . Sure , the yield on leafy greens is n't the best , but it does carrots , beets & celery as well an any other juicer -- and quickly , too . The yield is far better than the extractors that spit out the pulp right away . I 've been juicing on-and-off for the last decade , and I like that the parts for this juicer store easily while the food processor stays on my counter . BTW , if the juicer starts to rattle or spin , adding another carrot firmly will usually solve the problem .
XX	This attachment is EXCELLENT and doing organic appleasauce couldnt be easier . It 's easy to put together and the results are amazing . I core my apples , and from what I 've been told , that 's not even necessary although I still do it out of habit . Then boil them for a few minutes and drop them into the feed and out comes perfect applesauce . I did well over 20 quarts this year and my kids gobble it up , all organic and sugar free . They REQUEST it for snack ! Thanks KitchenAid ! By the way , this is Brians wife ...lol !
XX	The reason for a low rating is that I did not receive all the parts for a complete unit . I have not been able to use any part of this because I am missing the butterfly that goes on the end of the auger . I have tried to return this . It cost more to send it back and has been a hassle to contact anyone who will listen . Buying from this company is a joke .
XX	Be sure you match up the sizing of your coffee maker before buying this filter . There are many different sizes . For this filter it states directly on the box : Fits Krups coffee Makers Model Numbers : 252 , 466 , 467 , 458 , and 144.. Check out the Krups website just to be sure you have the correct size before placing your order with Amazon. . Filter came as stated . . I just did n't do my research before placeing the order. . re-ordering the correct size . .
XX	My municipal water is so horrible I will have to replace the wick annually . Keeps my 2000 sq ft house at about 40 percent throughout the winter .
XX	We bought this product , as part of our Dr. Weil '8 Weeks to Optimum Health ' regimen . And , we really love it . During the winter , when the bedroom gets so dry , the humidifier really does the trick . And , it may be in our heads , but the air really does seem to be cleaner than in the rest of the house .<p>This product has great air quality ratings ( HEPA , etc. ) relative to other products in its price range , and was easy to set up , etc.<p>Our only gripe is that it is a bit of a pain to clean . You need to take it all apart , etc . However , this may be the case with all of these products , and thus , may just be par for the course .<p>We recommend this product whole-heartedly .
XX	I loved the tray that came with my Nesco Dehydrator so much ; I had to have four more ! I buy a lot of fruit for my kids to eat , and I used to throw away a lot of fruit that would over ripen before they could eat it all (especially bananas ) . Once I got my dehydrator , I started making Fruit Leathers with the leftovers . my kids actually preferred it to the fresh fruit ! All I do is remove the peel from any fruit that is past its peak , throw it in the food processor , liquefy it , scoop it onto the Clean-A-Screen Tray and place it in the dehydrator . When it is dry I take the tray out- and give it to my kids to peel and place in airtight bags - they usually eat it all and never put any in bags ! I have even used it as " treat when you finish your homework ! " Can you believe that - they are eating fruit with no sugar added and think it is a special treat ! AWESOME! ! ! !
XX	I have no problems with the Foodsaver rolls ... those seem to work flawlessly . These pre-made bags , however , have been next to worthless . Perhaps I just received a bad batch but only about one out of every 5 bag will even begin to evacuate much less hold a seal . Those that do evacuate typical lose their seals after a while . I 'm sticking with the rolls from now on . One positive is that I can use the box these came in to store bags I 've made from the rolls for later reuse . Other than that , these bags have been frustrating in the extreme !
XX	I love this mixer . It is SOOO powerful ! I got one for my mother-in-law too .
XX	I have used the Hamilton Beach 05910 Humidifier for several years . The filters last a long time providing you use them as directed . I have been very satisfied with this product and with Amazon 's price and timely delivery .
XX	This humidifier is loud , the white noise could be soothing to some , but annoying for other people . The reason I am rating this with a 2 because it leaked a HUGE puddle of water the second night I used it . I returned this humidifier and went with theFuijitronic FB-602 Ultrasonic Humidifier with Built-in Ionizer and have n't had a single problem . Our toddler also loves the little bear design .
XX	Excellent product as far as portability . Love the wall mount feature , long cords also making using it an ease . Suction tube is too narrow and is susceptible to clogging . Otherwise an excellent product .
XX	This product was smaller than I had antisipated and the lid does n't fit as securely as other 's I have . One thing I do n't like about it is there are no type of handles and makes it very difficult and dangerous when removing from the oven when it is extremely hot .
XX	I , too , was hesitant about spending this much $ $ to make milkshakes ; however , the kids love to make shakes and the standard blender is hard for them to clean ( not to mention the sharp blades ) . After our first use , my 15-year-old son said that he was "Ecstatic ! " . Anyone with teenagers knows how hard it is to achieve an emotional response--normally I get a monosyllabic grunt .
XX	This company keeps making the containers full knowing that they will crack on the bottom . Some legal action needs to be taken against this fraud . Do n't buy anything from them
XX	I know many of you seen reviews about this product leaking , thats all bogus this is a great product . First of all the lid is so tight it took me like 5 minutes just to get it on , from time i saw that i knew it was n't going to leak i use it to mix my protein shakes and those little blades help to break all the clumps . So if you guys looking for a good protein shaker this is the one .
XX	When I ordered this item , it never stated that it worked with a mixer . Well I do not have the mixer that goes with this ice cream maker . It did not come this all items that it stated it came with . I think it would work fine if you had the mixer that worked with it . I also think the item has been used before .<br>Thank you<br>Michael A. Velto
XX	The Dirt Devil Vaccuum Cleaner bags arrived in excellent condition . I was happy to get them as I have n't been able to find them in the local stores . Thanks for the prompt order .
XX	I needed a little hand mixer for the little jobs and this does the little jobs well ! I use the kitchen aid for mixing cookies and other types of dough .
XX	The reviews are exactly as it is . If you are noise sensitive there are models that are better out there . This has a nice look but makes a high pitch noise . Other small fridges have a lower noise level . Beware if noise is a concern . Its not so loud as it is a high pitch .
XX	and have been more than happy with it . It is , I think , the low end of the Kitchenaid mixers , much like the classic . But I also think , from all the reviews I have read that this one will out do and out last the pricier and admittedly prettier Artisian series . I am not an uber baker , so I cannot say how long this would last if I baked everyday . With a little care I think a long time . The directions are very clear about what speeds to use and what amount of specific flours that should be used to ensure that the motor can handle the work . I do make more bread now than I used to , the ease of letting the mixer knead for 10 minutes while I am free to do other things in the kitchen is wonderful . Also for those big holiday meals this takes the work out of everything from baking to mashing potatos . Highly recomended .
XX	I recieved this product wrapped in newspaper , and it smelled . Beware if not purchasing from amazon.com . I also purchased the three layer flat filter from amazon - arrived perfectly .
XX	This is my first immersion blender , but I am impressed with its capabilities so far . I do like the multi-speed options and it seems to be a sturdy little instrument . The packaging , however , is a crime against the earth ! ! I would never have bought it , had I known that it came sandwiched between two huge nonbiodegradeable slabs of styrofoam . This aspect of the product seriously brings down its star rating in my book . Amazon , you too , put on an offensive packaging show . The KitchenAid box was packed in a huge box , many times larger than the purchased product , and stuffed with non-recyclable plastic . :(
XX	I followed the advice of others who reviewed this product in much greater detail ( thank you guys ) . Was going to buy a Dyson - think I saved a lot of money !
XX	I 'm a big fan of upright cordless vacuums for daily pickup of dog hair and dust bunnies on our tile and wood floors . These guys ca n't replace the power of a regular corded vac on carpets but are nice to have around for easy inbetween jobs on hard surfaces . After our old Eureka Boss died which we absolutely loved after a long life , we found they 're not made anymore so decided to try this one . It 's more powerful than the usual cordless uprights but is a pain to use . It shuts off if stood upright ( it 's supposed to ) and is very heavy to manouver around or get up and down a stair or two . The cannister fills up quickly . On the plus side , it 's better on rugs and carpets than the usual uprights . Not great , but good enough . For us , it 's not practical as one of the beauties of having a cordless is that the kids can help out with some easy vacuuming or I just whizz around for a quick pick-up . This model is too heavy for my children ( 8 & 11 ) to move from room to room where there are 2 stairs and they bang it on my hardwood floor accidentally as they try to lift it . It 's also too heavy for me as I have to be careful of my back . This model will be relegated to our basement which is just one big open area as I search for another lighter weight model . If my back was stronger , we had less furniture to manouver around , no steps , and more storage space for housing the big charger and big vacuum , I might like this model . But as such , it 's just not a very convenient tool to use in our house for a quick clean except in our open floored basement . I 've given it 3 stars as the suction is better than the usual cordless uprights . We have another new one at the office ( different brand to this ) and that one is pretty useless . The wand is a nice touch too for when you need it . But otherwise , too heavy and cumbersome for our type of house . And the automatic switch offs are a pain when you just want to whizz through the house quickly .
XX	This Hoover Floormate gets the job done , however if you have a larger hardwood/tile floor surface I would suggest spending more on the floormate with rotating brushes . Mine is over two years old and still works great but do plan on upgrading soon . No problems at all with it . Just need to change the filter every few months .
XX	I have purchased many humidifiers over the last 10-15 years as I have chronic sinus problems that are exacerbated by dry winter air . As you research the ratings of these appliances - you see that ALL models from ALL brands have glaring problems in their designs . I like the styling and feature set of the Bionaire brand - I have purchased 3 in total ... the model I liked best is no longer made - but i thought i would give these a try ----- If you have even remotely hard water and if you do n't want to be constantly replacing MOLDY wicking elements ----avoid this style of humidifier technology . They are terrible . And it is not Bionaire 's fault - all brands fall prey to the fundamental flaw of this approach to humidity . A wad of paper soaking in water all day/all night . It 's a shame because the Galileo remote hygrometer/control unit is very well thought out and the looks of these units are great . It 's just that wicking humidifiers are fundamentally the wrong approach . So until somebody make a wick that is impervious to both mineral deposits AND mold/mildew ... do n't waste your money . I liked my old warm mist Bionaire and I am considering one again . There is still a scale problem there , but it seems the least annoying of all the humidifier technologies in terms of performance , maintenance and byproducts like mold , white dust or scale . As for Bionaire - I feel there products are well built , smartly designed , attractive , acceptably quiet , and built to last a long time . I just do n't find the wick approach to be at all intelligent . too bad - maybe another model . Will let you know .
XX	In my handyman business , a small powerfull vac is a must . I 've had several Dirt Devils , tried Oreck 's Power Brush , and sent it back , because it , like the Dirt Devil handhelds are toys ; their motors are wimpy . After trying the Vac n' Blo , I finally found a vac that is n't a toy , yet it 's so quiet , you do n't think it 's going to have good suction , but it does - enough to run the optional power rug brush , which the Dirt Devil could n't do without a belt powered by the motor . Why less than perfect ? No attachment storage , and wheels would help , but they make you pay extra for that . But in the end , if you want a compact vac that 's not a wimp , this baby is for you .
XX	Just wanted to warn folks that Amazon 's dimensions info is incorrect . Do not go by their 10 " x 9 " description , as this top is considerably smaller . I 'm thinking these are the dimensions for the 2-1/2 quart version . Other than that , the top is perfectly fine and it 's nice that replacements are available .
XX	The product is fine . What I was impressed with was Amazon 's response when the product initially arrived in about 5 pieces . Using the online site I was able to get a replacement sent almost immediately at no cost . I am very appreciative of such a service-oriented company .
XX	Where do you get wicks ? I 've been looking all over and Amazon does n't even stock it ... Makes it kind of useless after a while ...
XX	I bought a 12 cup , two 8 cup , and 4 two cup Anchor Hocking glass storage containers . They would be terrific if the lids/containers were level . Instead , the lids teeter-totter on top of the containers , on some as much as 1/4" . Some are better than others , but none of them fit right . I will not purchase another Anchor Hocking product that is made in China ( like these were ) and/or without being able to examine them in person first .
XX	If you run this item on high for 4-5 hours & stick your nose up to the vent you MAY detect a odor of menthol ....maybe .
XX	Have had previous versions due to its great suction/cleaning . Have 2 dogs and 2 todlers/babies , with one of them alergic to dog hair , thus need great cleaning . This provides . Prior versions had issues with durability in the hose connections and had replaced several times due to wearing out as you disconnect and reconnect often for using tools . This one has a telescoping wand with a singular release and seems much more durable in the above problem area . Only negative is that it lost a feture where you could turn down the suction by letting other air in and without this it makes doing things like drapes or small rugs much harder .
XX	I 've used non-stick cookware for many years , including Calphalon 's three top brands and this is the BEST.
XX	This humidifier is completly over priced ( no matter where you purchase ) . On the lowest setting , you are supposed to get 24 hours , but you get 12 at best . It 's also obnoxiously loud . Yes , it humidifies the room , but there are plently of other humidifers out there that are worth the $ you pay for them . I should have done my research before purchasing this one .
XX	This completely revised and fully updated second edition of Mayo Clinic On Managing Diabetes : How To Prevent , Control And Live With Diabetes is drawn from the collective studies of the Mayo Clinic studies on diabetes prevention and care . Offering readers a complete and thorough understanding of diabetes , Mayo Clinic On Managing Diabetes includes in-depth research information on the pre-diabetes stage ; the latest guidelines for testing blood sugar ; selecting and using a glucose monitor ; the value of health checkups ; advances in insulin delivery ; new medications for diabetes ; the latest on transplantation ; tips to achieve a healthier weight ; advice for enjoying healthier foods ; safe exercise strategies ; avoiding serious complications arising from diabetes ; reducing the risk of heart and blood vessel disease ; recognizing and responding to diabetic emergencies ; sexual issues for both men and women with diabetes ; and unique issues for children with diabetes . Mayo Clinic On Managing Diabetes is very strongly recommended for all readers concerned with diabetes and searching for a comprehensive guide to its prevention , as well as for parents wishing to aide their children in prevention of juvenile diabetes .
XX	It is one of the good book I read eventhough the writer used more technical words that may not be easy for lay man .
XX	really well thought out book , explaining the different training zones inherent in our physiology and how they relate to practical methods of utilizing them to train better and understand the need for recovery and useful training levels .
XX	This book is wonderfully informative , plus it has so many full-color reproductions--the type of terrific catalog that inspires one to stroke its pages with a sense of seduction ( works in my mind ! ) .
XX	Not very memorable , honestly , even though I 'm a staunch liberal myself . Pick it up if you want a bit of light reading that agrees with your political views , but if that 's not your cup of tea , you may want to pass on this .
XX	Though not as good a book as the author 's " Imperial Grunts " this sequel is a very well-done work . As in the previous book , Kaplan visits U.S. military outposts , large and small , around the world , describing the quiet and usually effective efforts our elite troops are executing to keep peace and prepare , if necessary , for war . As another reviewer noted , this is primarily a military travelogue and Kaplan , who I believe is one of the premier travel writers of this or any other time , winnows out the fascinating and the exotic as he writes about the various U.S. posts and the troops who man them . Some of the chapters are very compelling , such as the one describing the "pilots " of the unmanned Predators , the one describing the B-2 bomber pilots , the submarine crews , the green berets and so on . All in all , a fine account of today 's military culture and the many ways we are waging -- overtly and covertly -- the Global War on Terrorism and wars to come .
